name,affiliations,author_id,cited_by,interests
Afshin Rahimi,Applied Scientist @ Amazon,WhPw2I0AAAAJ,1295,Natural Language Processing
Alberto Tonon,"PhD Student, University of Fribourg",zBYcXUMAAAAJ,468,"Computer Science, Information Retrieval, Semantic Web"
Alessandro Checco,Computer Science Department - University of Rome La Sapienza,crhkrNcAAAAJ,907,"Human Computation, Crowdsourcing, Graph Theory, Markov Chains, Wireless Networks"
Andrea Brunello,Università degli Studi di Udine,GuteS00AAAAJ,281,"Data science, machine learning, evolutionary computation, data modelling, databases"
Andrew Turpin,Lions Eye Institute and Curtin University,lCZblDwAAAAJ,6894,"Human vision, Computer vision, Information Science, Data Analysis"
Arkaitz Zubiaga,Queen Mary University of London,IUb-xxMAAAAJ,6639,"Social Media Mining, Social Data Science, Natural Language Processing, Computational Social Science, Computational Journalism"
Beatrice Portelli,University of Udine,HQZd6wsAAAAJ,145,
Ben Carterette,Spotify,zgHZ-KMAAAAJ,5784,"search, recommender systems, ML"
Carlo Alberto Beltrami,"Professore, Università di Udine",EZrMWWMAAAAJ,18400,cellule staminali
Carlo Tasso,Full Professor in Computer Science,ITxRmxIAAAAJ,3643,"Artificial Intelligence, Web Intelligence, Semantic Web"
Claudio Carpineto,Fondazione Ugo Bordoni,MnwqYB8AAAAJ,5541,"information retrieval, data mining, artificial intelligence, formal concept analysis, data privacy"
Claudiu S. Firan,,SRc8aowAAAAJ,1745,
Cristina Sarasua,University of Zurich,i_2lvZwAAAAJ,772,"CSCW, Digital Democracy, Civic Technology, Data Analytics, Knowledge Graphs"
Damiano Spina,"School of Computing Technologies, RMIT University",sLzYrNYAAAAJ,2492,"Information Retrieval, Text Analytics, Data Science, Evaluation, Human-AI Fact-checking"
Dante Degl'Innocenti,Datamantix,Ay6L7NsAAAAJ,117,"Artificial Intelligence, Deep Learning, Natural Language Processing, Data Science, Machine Learning"
David La Barbera,Università Degli Studi Di Udine,MvN8wKEAAAAJ,140,Computer Science
Davide Ceolin,"Tenured Researcher, CWI Amsterdam",y8Jy518AAAAJ,498,"Information Quality, Trust, Semantic Web, Probabilistic Logic, Provenance"
Djellel Difallah,"Assistant Professor, Computer Science, NYU Abu Dhabi",K5d-OHEAAAAJ,3094,"Crowdsourcing systems, Data science, Big Data systems"
"Dr. Wasim Ahmed, PhD",Senior Lecturer in Marketing,JduIcrAAAAAJ,2173,"Marketing, Disinformation, Social Media, Social Network Analysis, Analytics"
Eddy Maddalena,"Università degli Studi di Udine, Italy",egHDpFkAAAAJ,554,"Information Retrieval, Crowdsourcing, Data Science, Human Computation, Web science"
Edgar Meij,Bloomberg,vb6YKF0AAAAJ,3142,"Information Retrieval, Semantich Search, Machine Learning"
Elena Nazzi,"PhD student in Interaction Design, IT University of Copenhagen",krOJM2sAAAAJ,175,"Interaction Design, Social Computing, Tangible Computing, Internet of Things, Embodied Interaction"
Elena Simperl,"Professor of computer science, King's College London, United Kingdom",xB7s3wgAAAAJ,7030,"knowledge graphs, knowledge engineering, open data, social computing, human computation"
Fabio Crestani,"Faculty of Informatics, Universitá della Svizzera Italiana (USI), Lugano, Switzerland",EoGBsiMAAAAJ,10259,"Information Retrieval, Data Science, Text Mining, Digital Libraries"
Falk Scholer,"School of Computing Technologies, RMIT University",qOLjlqsAAAAJ,4655,"Information retrieval, search, … and ethics of algorithms AI and computing, data science, dat"
Flora Salim,"Professor, Cisco Chair of Digital Transport, Computer Science and Engineering, UNSW",Yz35RSYAAAAJ,3970,"Machine Learning, Artificial Intelligence, Ubiquitous Computing, Time Series, Mobility Data Science"
Gianluca Demartini,Associate Professor at the University of Queensland,PCAiILsAAAAJ,5358,"Information Retrieval, Semantic Web, Human Computation, Crowdsourcing"
Giorgio Brajnik,"Associate Professor in Computer science, University of Udine, Italy",a-qHaRIAAAAJ,3590,"User Experience, Software Testing, Model-based Engineering of User Interfaces"
Giuseppe Primiero,"Department of Philosophy, University of Milan",srKA534AAAAJ,1134,"Logic, Philosophy of Computer Science"
Giuseppe Serra,"Associate Professor of Computer Science, University of Udine",xz1J-xQAAAAJ,5347,"Machine Learning, Artificial Intelligence, Multimedia, NLP, Multimedia Forensics"
Hideo Joho,"Professor, Institute of Library, Information and Media Science, University of Tsukuba",8W8gwisAAAAJ,3888,"Information Retrieval, Interactive Information Retrieval, Human Information Interaction, User"
J. Shane Culpepper,The University of Queensland,OFlBSEEAAAAJ,3167,"Information Retrieval, Search, Algorithms, Machine Learning"
Jan Wielemaker,"Researcher in Computer Science, VU University Amsterdam",7J1vJdEAAAAJ,5070,"Logic programming, Semantic web"
Joel Mackenzie,The University of Queensland,3jQ1Zh4AAAAJ,647,"Information Retrieval, Web Search, Algorithms, Information Systems"
Johanne R. Trippas,"Vice-Chancellor's Research Fellow, School of Computing Technologies, RMIT University",x483lssAAAAJ,984,"Information Retrieval, Conversational Interfaces, Spoken Interaction Design, Conversational Search, Human Computer Interaction"
Jonathon Hare,"Professor of Machine Learning and Computer Vision, University of Southampton, United …",UFeON5oAAAAJ,4522,"Deep Learning, Representation Learning, Machine Learning, Computer Vision"
Jorge Carrillo-de-Albornoz,"Researcher in Computer Science, UNED",8yHMQqoAAAAJ,1386,"Sentiment Analysis, Opinion Mining, Online Reputation Management, Negation Detection, Natural Language Processing"
Julio Gonzalo,"Full professor of Computer Science, UNED",opFCmpYAAAAJ,6088,"Natural Language Processing, Information Retrieval, Artificial Intelligence"
Karl Aberer,"Professor of Computer and Communication Sciences, EPFL",ifU81ikAAAAJ,23854,"Social Media, Data Management, Data Integration, Trust Management, Semantic Web"
Kevin Roitero,University of Udine,1xd52jMAAAAJ,693,"Artificial Intelligence, Crowdsourcing and Human Computation, Information Retrieval"
Laura Sbaffi,"Senior Lecturer, Information School, University of Sheffield",TMKfR4AAAAAJ,3383,"Social care, trust in information, information literacy"
Lawrence Cavedon,"School of Computing Technologies, RMIT University",ZAEiiEUAAAAJ,5942,"Data Science, artificial intelligence, spoken dialogue, biomedical text mining"
Lei Han,The University of Queensland,Oibami4AAAAJ,230,
Luca Di Gaspero,"Associate Professor of Information Technology, University of Udine",fIES7P0AAAAJ,3659,"Artificial Intelligence, Operations Research, Data Analytics, Metaheuristics"
Luca Vassena,Università di Udine,dCBk3oIAAAAJ,359,"mobile, ir, context"
Luis-Daniel Ibáñez,University of Southampton,Vf-AkkUAAAAJ,695,"Linked Data, Collaborative Systems, Optimistic Replication, Provenance Semirings, Update Exchange"
Maarten de Rijke,University of Amsterdam & ICAI,AVDkgFIAAAAJ,36862,Information retrieval
Marco Basaldella,Amazon,SRvx2QoAAAAJ,522,
Marco Pavan,"PhD in Computer Science, University of Udine",-UudVuUAAAAJ,112,"Data Mining, Information Retrieval, Artificial intelligence"
Mark Sanderson,"School of Computing Technologies, RMIT University",HmqvvQkAAAAJ,13378,"Information Retrieval, Data Analysis, Recommender Systems"
Mattia Zeni,"Databricks, TomTom, IBM Research, University of Trento, Create-net",DL18RZEAAAAJ,611,"Big Data, AI, Machine Learning, Human-Centered AI, Privacy-Aware Machine Learning"
Michael Soprano,Postdoctoral Research Fellow at the University of Udine,ocK0qRUAAAAJ,211,"Crowdsourcing, Misinformation Assessment, Cognitive Biases"
Michele Catasta,VP of AI at Replit,ZxfOSWMAAAAJ,6091,"Large Language Models, AI4Code, Machine Learning, Information Retrieval, Data Science"
Mihai Horia Popescu,PhD student,7VIbKlEAAAAJ,47,"Machine learning, medical informatics, Explainable Artificial Intelligence (XAI)"
Mounia Lalmas,Spotify,wAr9G5sAAAAJ,10876,Personalization.
Omar Alonso,Amazon,VvLUqbkAAAAJ,4345,"Information Retrieval, Crowdsourcing, Social search, Knowledge graphs"
Paolo Coppola,"Associate Professor of Computer Science, University of Udine",P15-SKkAAAAJ,533,"Type theory, lambda calculus, computational complexity, context aware computing, mobile computing"
Pavlos Vougiouklis,Huawei Technologies,9J7YeR0AAAAJ,585,
Peter A Bath,University of Sheffield,-ExSN_IAAAAJ,7126,"Health Informatics, Health Data Science, Information behaviours, Older people, online sharing"
Philippe Cudre-Mauroux,"Full Professor (Computer Science), U. of Fribourg–Switzerland",NpccCXwAAAAJ,9334,"Big Data, Graph Data, Infrastructures for AI, Emergent Semantics"
Raquel Martinez,"Full Professor of Computer Science, UNED University",m0-0QxgAAAAJ,1195,"Natural Language Processing, Document Clustering, Multilinguality, Person name desambiguation, Document representation"
Richard Gomer,University of Southampton,5ZTLglQAAAAJ,282,"privacy, consent, interaction, hci, web science"
Rishabh Mehrotra,"Head of AI, Sourcegraph",X9BKWWoAAAAJ,2285,"Machine Learning, Recommender Systems, Large Language Models"
Ryen W. White,"General Manager, Deputy Lab Director, Microsoft Research",U69fiZMAAAAJ,20490,"Information Retrieval, Human-Computer Interaction, Artificial Intelligence, Psychology, Health"
Shaoyang Fan,The University of Queensland,uF87D5kAAAAJ,80,"Crowdsourcing, Human computation, Information Retrieval, Data Mining"
Shazia Sadiq,The University of Queensland,1Jo0EmIAAAAJ,10263,"Data Quality Management, Business Process Management, … Risk and Compliance in Information Systems, Service Systems"
Stefano Mizzaro,Full professor of Computer Science and Information Technology,2wvJC6IAAAAJ,4744,"Information retrieval, mobile systems, scholarly publishing, crowdsourcing, misinformation and fake news detection"
Tereza Iofciu,L3S,wQgkh-4AAAAJ,1215,"machine learning, artificial intelligence, data science"
Tetsuya Sakai,Waseda University,vi56gz4AAAAJ,6631,"information retrieval, natural language processing, human computer interaction"
Tim Draws,OTTO,UTMHOZMAAAAJ,1210,"Human-Computer Interaction, Web Search, Research Methods"
Ujwal Gadiraju,"Assistant Professor, Web Information Systems, Delft University of Technology",FX7BF6QAAAAJ,3274,"Human-centered AI, Crowd Computing, Human-Computer Interaction, Information Retrieval, Conversational Interfaces"
Vincenzo Della Mea,"Associate Professor of Medical Informatics, University of Udine",BF3B4KAAAAAJ,2894,"medical informatics, telemedicine, digital pathology, biomedical classifications and ontologies"
Víctor Fresno,Associate Professor of Computer Science (UNED),X_95ZxEAAAAJ,1558,"Document Representation, Natural Language Processing, Machine Learning, Compositional Distributional Semantics"
W. Bruce Croft,"Distinguished Professor Emeritus, University of Massachusetts Amherst",ArV74ZMAAAAJ,64268,Information Retrieval
Wolfgang Nejdl,"… of Computer Science, Leibniz Universität Hannover, L3S Research Center, Hannover …",LC62bdYAAAAJ,25486,"Information Retrieval, Web Science, Social Media, Data Mining, Semantic Technologies"
Yongli Ren,"School of Computing Technologies, RMIT University",ZZl7bW8AAAAJ,1275,"Recommender System, Data Mining, Fog Computing, Data Science, Data Analysis"
Yunke Qu,The University of Queensland,oup2M48AAAAJ,11,"Recommender Systems, Data Mining, Information Retrieval"
